{
  "schema_version": "2.0.0",
  "intent_id": "018f1e2d-3c4b-7a05-8c9d-001122334459",
  "session_id": "018f1e2d-3c4b-7a02-8c9d-001122334456",
  "tenant_id": "018f1e2d-3c4b-7a01-8c9d-001122334455",
  "actor_id": "018f1e2d-3c4b-7a04-8c9d-001122334458",
  "actor_type": "presenter",
  "tool_contract_id": "catalog.lookup",
  "action": "get_plan",
  "arguments_json": "{\"plan_id\":\"growth\"}",
  "purpose": "Responder pergunta explícita de preço.",
  "idempotency_key": "tenant-session-get-plan-growth",
  "requested_at": "2026-07-14T20:00:00Z",
  "expires_at": "2026-07-14T21:00:00Z"
}
